{
  "scene_id": "cp002_p04_s2",
  "chapter_id": "cp002",
  "passage_id": "p04",
  "scene_type": "climax",
  "purpose_cn": "全段情感顶峰：刘陶恸哭直谏被斩，陈耽撞阶下狱当夜被害——以两条忠臣之命写尽王朝自毁。十常侍的哭诉操控术与灵帝的偏听形成'好人全输'的绝望格局",
  "setting_cn": "灵帝后花园 → 刑场 → 狱中",
  "characters": ["liu_tao", "chen_dan", "emperor_ling", "shi_chang_shi"],
  "scene_goal_cn": "灵帝后园与十常侍饮宴，谏议大夫刘陶径至帝前大恸。帝问故，陶曰'天下危在旦夕，陛下尚与阉宦共饮耶'。帝曰'国家承平有何危急'，陶直指'四方盗贼并起，其祸皆由十常侍卖官害民欺君罔上'。十常侍免冠跪伏痛哭——'大臣不相容臣等不能活矣'——帝反怒斥刘陶'汝家亦有近侍之人何独不容朕'，推出斩之。刘陶大呼'臣死不惜！可怜汉室四百余年到此一旦休矣'。陈耽喝住行刑，入谏'天下人民欲食十常侍之肉'、以头撞阶。帝仍曰'十常侍中岂无一二忠臣'，命牵出下狱。当夜十常侍于狱中谋杀二人。要点：这场戏的张力在于'每次有人站出来说真话，都会被假哭打倒'——十常侍的哭诉是全段最精妙的操控，灵帝那句'岂无一二忠臣'是糊涂的极致",
  "tension_level": 0.9,
  "must_include": [
    "灵帝后园与十常侍饮宴——昏聩的日常",
    "刘陶径至帝前大恸——不请自来",
    "'天下危在旦夕，陛下尚与阉宦共饮耶'——核心台词",
    "十常侍免冠跪伏痛哭——操控术的表演",
    "灵帝反怒斥刘陶——忠言被当作冒犯",
    "刘陶被推出斩首的临终大呼",
    "陈耽喝住行刑、入谏、以头撞阶——'天下人欲食十常侍之肉'",
    "灵帝'十常侍中岂无一二忠臣'——至死不悟",
    "当夜十常侍于狱中谋杀刘陶、陈耽"
  ],
  "must_avoid": [
    "让刘陶的谏言变成说教——原文是'大恸'先于语言，情绪爆发是核心",
    "削弱十常侍哭诉的效果——这招对灵帝是管用的，这是操控的可怕",
    "让陈耽的撞阶变成单纯的'壮烈'——这是走投无路后的最后手段",
    "让狱中谋杀显得突兀——十常侍杀人是他们一贯的解决方式",
    "加入孙坚讨区星的详细过程——只用作'假帝诏'的一个后果带过"
  ],
  "status": "draft"
}
