{
  "scene_id": "cp001_p04_s2",
  "chapter_id": "cp001",
  "passage_id": "p04",
  "scene_type": "tactical",
  "purpose_cn": "刘备不只是会打仗——他会打仗的脑子。青州被围，援军首战不利退三十里。刘备停下来想，想出了分兵埋伏的计策。这是读者第一次看到刘备从'有志向的人'变成'有谋略的将'。三路夹攻大破贼军",
  "setting_cn": "青州城外三十里",
  "characters": ["liu_bei", "guan_yu", "zhang_fei", "zou_jing", "gong_jun"],
  "scene_goal_cn": "大兴山胜后不久，青州太守龚景来求救——黄巾围城将破。刘备主动请缨。邹靖带五千人同往。但到了青州一交手，贼众兵多，打不过，退了三十里下寨。关羽和张飞不说话，等刘备拿主意。刘备说：贼众我寡，得用奇兵——关羽带一千人埋伏山左，张飞带一千人埋伏山右，我和邹靖正面诱敌，鸣金为号。次日依计行事，三路夹攻大破贼军，解了青州之围。这场仗要写出刘备的冷静和判断力",
  "tension_level": 0.7,
  "must_include": [
    "青州太守龚景求援文书",
    "刘备主动请缨：'备愿往救之'",
    "邹靖将兵五千同往",
    "首战不利，退三十里下寨",
    "刘备说'贼众我寡，必出奇兵'",
    "分兵部署：关羽山左、张飞山右、刘备正面诱敌、鸣金为号",
    "三路夹攻大破贼军",
    "龚景率民兵出城助战",
    "解青州之围"
  ],
  "must_avoid": [
    "让刘备的分兵计策听起来太复杂——三两句讲清楚就行",
    "让关羽和张飞质疑刘备的计策——他们信大哥",
    "展开龚景的角色——他就是求救的信号",
    "再写一次战斗细节——聚焦在计策的设计和执行上，不重复s01的杀敌场面",
    "让邹靖抢功劳或拖后腿——他配合就行"
  ],
  "status": "draft"
}
