{
  "scene_id": "cp002_p05_s2",
  "chapter_id": "cp002",
  "passage_id": "p05",
  "scene_type": "escalation",
  "purpose_cn": "用'两宫角力'展示何进的性格核心——对自己人够狠（废董太后），对宦官不敢动（被太后一句话劝退）。这种反差是全段最大的讽刺",
  "setting_cn": "何进府→皇宫（何太后处）→宫宴→河间驿庭",
  "characters": ["he_jin", "he_taihou", "dong_taihou", "yuan_shao", "he_miao", "zhang_rang"],
  "scene_goal_cn": "袁绍催杀宦官。张让等求何太后庇护，太后以'寒微时靠他们'劝何进——何进退缩。董太后趁机反击，临朝听政、封刘协为王、董重掌兵。两宫宴上撕破脸——'汝家屠沽小辈'。何进废董太后，董重自刎，鸩杀董后。要点：何进对自己人毫不手软，杀宦官却犹豫不决——杀猪的勇气他有，杀狼的勇气他没有",
  "tension_level": 0.6,
  "must_include": [
    "袁绍催尽诛宦官",
    "张让求何太后，太后劝何进'非张让等焉能享此富贵'",
    "何进退缩'其余不必妄加残害'",
    "董太后临朝听政、封陈留王、董重骠骑将军",
    "何太后设宴劝董太后'深居九重'",
    "董太后大怒'汝家屠沽小辈，有何见识'",
    "何进废董太后迁河间、董重自刎、鸩杀董后"
  ],
  "must_avoid": [
    "把两宫争斗写成宫斗长篇——压缩在关键对话",
    "展开何太后劝董太后的长篇大论——点到'吕后之祸'即可",
    "让董太后显得只是跋扈——她也有她的立场",
    "详写董重之死——一笔带过"
  ],
  "status": "draft"
}
