{
  "scene_id": "cp001_p02_s2",
  "chapter_id": "cp001",
  "passage_id": "p02",
  "scene_type": "pressure",
  "purpose_cn": "将刘备二十八年的等待浓缩为一个瞬间——面对招兵榜文的慨然长叹，暴露出他内心最深的矛盾",
  "setting_cn": "涿县城门，招兵榜文前",
  "characters": ["liu_bei"],
  "scene_goal_cn": "二十八岁的刘备站在榜文前叹息。这一叹要承载二十八年的压抑：皇族血统、天子之志、名师之教，却只换来贩屦织席。黄巾之乱给了机会，但他没有兵、没有钱、没有人。叹息是他此刻唯一能做的事——但也是引出张飞的触发器",
  "tension_level": 0.6,
  "must_include": [
    "刘备年已二十八岁",
    "见了榜文慨然长叹",
    "叹的不是怕死，而是恨力不能"
  ],
  "must_avoid": [
    "让刘备自怨自艾",
    "展开对黄巾之乱的再次叙述",
    "过早引入张飞"
  ],
  "status": "draft"
}
