{
  "scene_id": "cp001_p04_s3",
  "chapter_id": "cp001",
  "passage_id": "p04",
  "scene_type": "transition",
  "purpose_cn": "从青州转向更大的战场——刘备想起恩师卢植正在广宗与张角主力对峙。三兄弟带着五百人投奔卢植。这是从地方小仗走向天下大局的转折。卢植认出了刘备——师徒重逢",
  "setting_cn": "青州 → 广宗，卢植军中",
  "characters": ["liu_bei", "guan_yu", "zhang_fei", "zou_jing", "lu_zhi"],
  "scene_goal_cn": "青州解围后，邹靖要带兵回幽州复命。刘备说了自己的打算：听闻恩师卢植正在广宗与贼首张角的主力对峙，我要去助他。邹靖引军自回。三人带着本部五百人往广宗去。到了卢植军中，入帐施礼，说了来意。卢植认出了自己从前的学生，大喜，留在帐前听调。但卢植给了新任务：张角十五万人我围在这里了，他弟弟张梁张宝在颍川跟皇甫嵩朱儁对垒。你带你的五百人，我再给你一千官军，去颍川打探消息，约期剿捕。简洁收束，为p05埋线",
  "tension_level": 0.3,
  "must_include": [
    "邹靖引军回幽州",
    "刘备提及师从卢植，决定投广宗助师",
    "三人带本部五百人投广宗",
    "卢植军中入帐施礼，具道来意",
    "卢植大喜，留帐前听调",
    "卢植交代局势：十五万贼兵对五万官军在广宗对峙",
    "新任务：引本部人马加一千官军投颍川打探消息"
  ],
  "must_avoid": [
    "展开师徒重逢的情感戏——点到即可",
    "铺开广宗战场的军事部署",
    "让卢植变成话多的角色——他是大儒名将，说话简短有力",
    "在邹靖离场上停留"
  ],
  "status": "draft"
}
