{
  "scene_id": "cp001_p01_s1",
  "chapter_id": "cp001",
  "passage_id": "p01",
  "scene_type": "setup",
  "purpose_cn": "建立天下大势的宏观背景，从汉室衰微到朝政日非",
  "setting_cn": "全知视角叙述，从温德殿到朝堂内外",
  "characters": [],
  "scene_goal_cn": "用精炼笔法交代：汉朝气数将尽，桓灵二帝崇信宦官，天降异象警告，忠臣蔡邕被逐，十常侍把持朝政。读者应在短时间内感到'这个朝廷烂透了'",
  "tension_level": 0.3,
  "must_include": [
    "分久必合合久必分的总纲",
    "至少两个天降异象（大青蛇、地震或黑气）",
    "十常侍专权、帝呼张让为阿父"
  ],
  "must_avoid": [
    "逐条罗列所有异象",
    "展开窦武、陈蕃的政变细节",
    "写成历史教科书"
  ],
  "status": "draft"
}
