{
  "scene_id": "cp002_p05_s3",
  "chapter_id": "cp002",
  "passage_id": "p05",
  "scene_type": "climax",
  "purpose_cn": "全章高潮——袁绍的'奇计'、陈琳的清醒、何进的傲慢、曹操的冷笑，四个人物四种态度汇聚于此。最终以'召外兵入京'收束——这是全章最致命的决策，也是何进唯一果断的决定",
  "setting_cn": "何进府（议事厅）",
  "characters": ["he_jin", "yuan_shao", "chen_lin", "cao_cao", "he_miao"],
  "scene_goal_cn": "袁绍再催杀宦官，说张让等流言何进鸩杀董后。何进入白太后，太后不允'汉家故事'。何苗受贿替宦官说情。何进犹豫——袁绍献计召四方英雄勒兵来京'此时事急不容太后不从'。陈琳谏'倒持干戈授人以柄'被何进笑拒。曹操鼓掌大笑。要点：三个清醒的声音全部被无视，何进偏偏选了最蠢的路",
  "tension_level": 0.9,
  "must_include": [
    "袁绍催诛宦官——'乘此时不诛后必大祸'",
    "何后阻拦'中官统领禁省，汉家故事'",
    "何进'本是没决断之人'——关键性格定位",
    "何苗受贿替宦官说情",
    "袁绍献计'召四方英雄勒兵来京'",
    "陈琳痛斥'倒持干戈授人以柄，功必不成反生乱矣'",
    "何进笑曰'此懦夫之见'",
    "曹操鼓掌大笑'此事易如反掌何必多议'",
    "檄文发至各镇——何进托病不出"
  ],
  "must_avoid": [
    "让陈琳的谏言变成政治学论文——'倒持干戈授人以柄'八个字必须砸响",
    "让曹操显得全知全能——他只是觉得事情很简单却被搞得这么复杂",
    "让何进显得完全无脑——他是被太后、何苗、袁绍三方拉扯，最终选了最省事的路",
    "提前暗示董卓的具体威胁——此时只知道'外兵入京'，不知道狼是谁"
  ],
  "status": "draft"
}
