{
  "scene_id": "cp002_p05_s1",
  "chapter_id": "cp002",
  "passage_id": "p05",
  "scene_type": "setup",
  "purpose_cn": "用'帝崩疑云'建立全段紧张基调——灵帝将死，权力真空即将出现，各方势力蠢蠢欲动。何进差点被杀、曹操首次被训斥、袁绍提兵拥立——这一场定下'何进被推着走'的基调",
  "setting_cn": "洛阳皇宫→何进私宅→灵帝柩前",
  "characters": ["he_jin", "jian_shuo", "pan_yin", "cao_cao", "yuan_shao"],
  "scene_goal_cn": "灵帝病笃召何进入宫，蹇硕设伏欲杀之。潘隐告密，何进逃归私宅召众大臣，欲诛宦官——曹操劝'安能尽诛'被训斥。灵帝崩，蹇硕秘不发丧矫诏，潘隐再报。袁绍挺身请兵五千，斩关入内册立新君。太子辩即位。要点：这是何进一生唯一果断的时刻——因为他被袁绍推着走。曹操的第一句话已经被无视了",
  "tension_level": 0.8,
  "must_include": [
    "灵帝病笃，何进出身屠家、因妹为后得权——一笔带过",
    "蹇硕奏请先诛何进、帝然之",
    "潘隐告密'蹇硕欲谋杀公'，何进急归",
    "何进召大臣欲诛宦官，曹操劝阻被斥",
    "灵帝崩，蹇硕秘不发丧、矫诏召何进",
    "袁绍愿借精兵五千斩关入内",
    "太子辩即皇帝位"
  ],
  "must_avoid": [
    "展开何进家世背景",
    "详细描写蹇硕设伏的过程",
    "让册立新君变成冗长的仪式描写",
    "让曹操的劝阻显得有预谋——他只是直觉判断"
  ],
  "status": "draft"
}
