{
  "scene_id": "cp002_p02_s3",
  "chapter_id": "cp002",
  "passage_id": "p02",
  "scene_type": "reversal",
  "purpose_cn": "最终决战：孙坚首登城头、飞身夺槊斩赵弘，玄德射杀孙仲——以连续的动作场面完成黄巾余党的终结",
  "setting_cn": "宛城攻城战场 → 城头 → 城门",
  "characters": ["sun_jian", "liu_bei", "zhao_hong", "sun_zhong", "zhu_jun"],
  "scene_goal_cn": "朱儁分兵：孙坚打南门，刘备打北门，朱儁打西门，留东门给贼逃。孙坚第一个登上城头，斩贼二十余人——这是他战场首秀的高光时刻。赵弘飞马突槊来战，孙坚飞身夺其槊反刺赵弘下马，骑其马往来杀贼。另一路孙仲突出北门正遇刘备，玄德一箭射杀。朱儁大军掩杀，斩首数万，南阳十余郡皆平。要点：孙坚的动作戏要连贯有力——登城、夺槊、反杀，一气呵成，让读者看到一个'猛虎下山'的形象",
  "tension_level": 0.9,
  "must_include": [
    "三面攻城、留东门的部署",
    "孙坚首先登城斩贼二十余人",
    "孙坚飞身夺赵弘槊、刺赵弘下马",
    "孙坚骑赵弘马往来杀贼",
    "玄德一箭射杀孙仲",
    "朱儁大军掩杀，斩首数万",
    "南阳十余郡皆平"
  ],
  "must_avoid": [
    "让战斗变成招式罗列",
    "省略孙坚'夺槊反杀'的核心动作——这是人物高光",
    "让刘备射杀孙仲抢了孙坚的风头",
    "拖长战后清剿的描写"
  ],
  "status": "draft"
}
