{
  "scene_id": "cp002_p01_s2",
  "chapter_id": "cp002",
  "passage_id": "p01",
  "scene_type": "reversal",
  "purpose_cn": "本段落核心战场戏：张宝妖法逞威→官军溃败→破法反杀，构成一个完整的'败-计-胜'三段式",
  "setting_cn": "朱儁军阵前 → 山后高冈伏兵处",
  "characters": ["zhang_bao", "zhang_fei", "liu_bei", "guan_yu", "zhu_jun"],
  "scene_goal_cn": "第一轮交锋：张飞刺高升落马（勇武展示），但张宝作妖法逆转（黑气漫天、风雷大作、无限人马从天而降），官军大乱败退。朱儁献破法计：猪羊狗血+秽物从高处泼下。次日再战，关张设伏，号炮一响秽物齐泼——纸人草马坠地、妖法破解。张宝兵败，玄德射中其左臂。重点：妖法场面要有压迫感，破法时刻要有释放感",
  "tension_level": 0.8,
  "must_include": [
    "张飞速杀高升",
    "张宝妖法的恐怖视觉：黑气、风雷、飞砂走石、空中人马",
    "朱儁献破法之计的具体部署",
    "破法一击：号炮、秽物齐泼、纸人草马坠地",
    "玄德射中张宝左臂"
  ],
  "must_avoid": [
    "把妖法写成真正的鬼神之力——应暗示是术数惑众",
    "让朱儁的计策显得复杂拖沓",
    "省略破法的视觉冲击"
  ],
  "status": "draft"
}
