{
  "scene_id": "cp001_p01_s2",
  "chapter_id": "cp001",
  "passage_id": "p01",
  "scene_type": "pressure",
  "purpose_cn": "展示乱世如何从底层爆发：一个落第秀才如何聚众数十万",
  "setting_cn": "巨鹿郡 → 八州蔓延 → 张角密谋举事",
  "characters": ["zhang_jiao", "zhang_bao", "zhang_liang"],
  "scene_goal_cn": "让张角从'不第秀才'变成'天公将军'的过程可信且紧凑：得天书→施符水治病→信徒日众→立三十六方→密谋举事→事泄→星夜起兵。重点传达'苍天已死，黄天当立'的口号力量",
  "tension_level": 0.6,
  "must_include": [
    "张角入山得天书《太平要术》",
    "苍天已死黄天当立的口号",
    "信徒遍布八州、裹黄巾从反者四五十万",
    "张角自称天公将军"
  ],
  "must_avoid": [
    "把南华老仙写成奇幻场面",
    "详细展开马元义、封谞的宫廷阴谋",
    "让张角成为可同情的悲剧人物"
  ],
  "status": "draft"
}
