{
  "scene_id": "cp002_p03_s1",
  "chapter_id": "cp002",
  "passage_id": "p03",
  "scene_type": "setup",
  "purpose_cn": "用'不公的封赏'为整段打下情感基调——同样的战功，有人情者飞黄腾达，没靠山者门前冷落。先压后爆的'压'",
  "setting_cn": "洛阳京城街道 → 安喜县衙",
  "characters": ["liu_bei", "guan_yu", "zhang_fei"],
  "scene_goal_cn": "朱儁班师回京封车骑将军，表奏孙坚、刘备之功。孙坚有人情，得官上任去了；刘备听候日久不得除授，三人郁郁上街。遇郎中张钧，自陈功绩，张钧上书请斩十常侍被逐出。十常侍为息怨敷衍——刘备仅得定州中山府安喜县尉。三人赴任，与民秋毫无犯，食则同桌寝则同床。要点：用孙坚的'有人情'与刘备的'听候日久'做尖锐对比，张钧上书被逐暗示整个朝廷已被十常侍把控，为督邮的嚣张做制度铺垫",
  "tension_level": 0.3,
  "must_include": [
    "孙坚有人情得官 vs 刘备听候日久不得除授——不公对比",
    "张钧上书请斩十常侍、被十常侍反咬'欺主'",
    "十常侍敷衍：'权且教省家铨注微名'",
    "安喜县尉——沙场浴血只得一县尉",
    "三人赴任，秋毫无犯，食则同桌寝则同床"
  ],
  "must_avoid": [
    "展开十常侍的政治细节",
    "让张钧上书写成朝堂辩论",
    "让'秋毫无犯'变成叙事重点——只是点明三兄弟的人品",
    "提前暗示沙汰诏书"
  ],
  "status": "draft"
}
