{
  "scene_id": "cp001_p03_s2",
  "chapter_id": "cp001",
  "passage_id": "p03",
  "scene_type": "bond",
  "purpose_cn": "全章情感巅峰——桃园结义。三人焚香跪拜，誓告天地，生死与共。要庄重、有仪式感，但誓言要精炼不拖沓。结义后招三百乡勇痛饮，豪气干云",
  "setting_cn": "张飞庄后桃园，花开正盛",
  "characters": ["liu_bei", "guan_yu", "zhang_fei"],
  "scene_goal_cn": "张飞提议结义（庄后桃园花开正盛，明日祭告天地）。次日备乌牛白马祭礼，三人焚香再拜。誓言核心：同心协力、救困扶危、上报国家下安黎庶、不求同生但求同死——用简洁有力的现代中文写出古风的庄重。拜刘备为兄、关羽次之、张飞为弟。祭罢宰牛设酒，聚乡中勇士三百余人痛饮。这一幕要让读者感受到三颗赤诚之心的共振",
  "tension_level": 0.8,
  "must_include": [
    "张飞提议结义：庄后桃园、花开正盛",
    "乌牛白马祭礼的准备（不展开过程，点到即可）",
    "焚香再拜的仪式感",
    "誓言核心内容：同心协力、救困扶危、上报国家下安黎庶、不求同生但求同死",
    "排定兄弟：刘备为兄、关羽次之、张飞为弟",
    "聚乡中勇士三百余人、痛饮一醉"
  ],
  "must_avoid": [
    "把誓言写成冗长的古文原文照搬",
    "用廉价的'热泪盈眶'等词描写情绪",
    "展开祭礼准备的技术细节",
    "让刘备在结义中显得功利",
    "忽略张飞作为提议者的角色"
  ],
  "status": "draft"
}
