{
  "scene_id": "cp002_p03_s3",
  "chapter_id": "cp002",
  "passage_id": "p03",
  "scene_type": "reversal",
  "purpose_cn": "全书名场面：张飞怒鞭督邮——从'忍无可忍'到'痛快爆发'到'决然弃官'，三兄弟与体制的第一次决裂",
  "setting_cn": "馆驿前街 → 县衙前马桩",
  "characters": ["zhang_fei", "liu_bei", "guan_yu", "du_you"],
  "scene_goal_cn": "张飞饮了数杯闷酒，乘马过馆驿，见五六十老人痛哭。闻督邮逼勒县吏欲害刘公、百姓苦告不得入反被打——大怒，睁圆环眼咬碎钢牙，直入馆驿揪督邮头发拖出，绑于马桩，柳条鞭打至十数枝折断。刘备闻讯赶来，督邮求救。刘备喝止张飞，关公转出劝道：'兄长建许多大功仅得县尉，今反被侮辱——枳棘丛中非栖鸾凤之所，不如杀督邮弃官归乡，别图远大之计。'刘备取印绶挂督邮颈上，责之'据汝害民本当杀却，今姑饶命'，缴还印绶，三人辞官投代州刘恢。要点：这是全回最痛快的一段，节奏要快、动作要猛、情感要满——张飞的怒是替读者出的气，关公的冷静是给弃官找道理，刘备的挂印是仁慈与决断的合一",
  "tension_level": 0.95,
  "must_include": [
    "张飞饮闷酒——不是主动寻事，是情绪积累到临界点",
    "五六十老人门前痛哭——百姓的无助点燃张飞",
    "张飞'睁圆环眼咬碎钢牙'——标志性暴怒形象",
    "直入馆驿、揪头发、拖出、绑马桩——动作连贯",
    "柳条鞭打十数枝折断——痛感的具象化",
    "刘备赶来喝止——仁慈但不保护督邮",
    "关公'枳棘丛中非栖鸾凤之所'——弃官的理性判断",
    "刘备挂印督邮颈上、缴还印绶——体面地与体制切割"
  ],
  "must_avoid": [
    "让鞭打过程拖沓——这是爆发，节奏要猛要快",
    "让刘备的喝止消解张飞的正义感——他拦的是'打死'不是'打'",
    "省略关公的弃官建议——关公在此处的角色是给行动赋予方向",
    "让挂印显得软弱——这是'我不稀罕'的骄傲，不是无奈退让"
  ],
  "status": "draft"
}
