{
  "scene_id": "cp002_p01_s3",
  "chapter_id": "cp002",
  "passage_id": "p01",
  "scene_type": "closure",
  "purpose_cn": "以各路捷报的形式宣告黄巾全面覆灭，为战场阶段画上句号",
  "setting_cn": "阳城围攻前线 → 探子回报",
  "characters": ["zhu_jun", "liu_bei"],
  "scene_goal_cn": "阳城围攻中，探子带来全面捷报：皇甫嵩斩张梁于曲阳，张角已死戮尸枭首，卢植复官，曹操除济南相。最后张宝被部下严政刺杀献首。朱儁上表献捷。要点：不是冷冰冰的战报罗列，而是让读者感到'这场浩大的叛乱终于结束了'，同时为功赏不公留下隐忧",
  "tension_level": 0.3,
  "must_include": [
    "张角病死、戮尸枭首",
    "张梁被皇甫嵩斩于曲阳",
    "卢植复官",
    "曹操除济南相",
    "张宝被严政刺杀献首",
    "朱儁上表献捷"
  ],
  "must_avoid": [
    "逐条平铺直叙如同流水账",
    "展开卢植复官的细节",
    "在此处暗示三兄弟的封赏问题"
  ],
  "status": "draft"
}
