{
  "scene_id": "cp001_p05_s1",
  "chapter_id": "cp001",
  "passage_id": "p05",
  "scene_type": "convergence",
  "purpose_cn": "多方力量汇聚颍川。皇甫嵩朱儁火攻破贼，曹操登场拦截败军。三兄弟赶到时仗已打完——他们错过了主战场，但即将撞上更大的事。曹操的首次亮相要短而锐利",
  "setting_cn": "颍川长社",
  "characters": ["liu_bei", "guan_yu", "zhang_fei", "cao_cao", "huangfu_song", "zhu_jun"],
  "scene_goal_cn": "三兄弟赶到颍川，远处火光冲天、喊杀声震天。等他们到时，仗已经打完了。皇甫嵩和朱儁趁大风夜袭，火攻烧了黄巾军连营。张梁张宝带残兵败走，被一彪红旗军马截住——为首一将，身长七尺，细眼长髯，骑都尉曹操。曹操大杀一阵斩首万余。三兄弟见到皇甫嵩朱儁，转达卢植之意。皇甫嵩说：张梁张宝必投广宗，你星夜回去助你老师。这一幕要让读者感觉到：战场很大，三兄弟只是其中一小支力量。同时曹操的亮相要给人留下印象",
  "tension_level": 0.4,
  "must_include": [
    "远处看到火光和喊杀声",
    "到时仗已打完——皇甫嵩朱儁火攻大破黄巾",
    "曹操登场：身长七尺、细眼长髯、骑都尉、沛国谯郡人",
    "曹操截杀败军斩首万余级",
    "三兄弟见皇甫嵩朱儁，转达卢植之意",
    "皇甫嵩令刘备星夜回助卢植"
  ],
  "must_avoid": [
    "展开火攻的详细过程——三兄弟没参与",
    "展开曹操的少年时代和出身背景——几句话定妆",
    "让三兄弟和曹操有深入互动——他们此时只是擦肩而过",
    "展开皇甫嵩朱儁的角色——他们是高级将领，点到即可"
  ],
  "status": "draft"
}
