{
  "scene_id": "cp002_p03_s2",
  "chapter_id": "cp002",
  "passage_id": "p03",
  "scene_type": "pressure",
  "purpose_cn": "层层加压：从朝廷的冷漠到督邮的直接欺压——用具体的嚣张行为点燃读者和张飞的怒火",
  "setting_cn": "安喜县衙 → 馆驿",
  "characters": ["liu_bei", "guan_yu", "zhang_fei", "du_you"],
  "scene_goal_cn": "到任未及四月，朝廷降诏沙汰军功官吏，刘备疑在遣中。督邮行部至县：城外坐马不还礼、馆驿高坐审问出身、大喝'诈称皇亲虚报功绩'。刘备退回与县吏商议，县吏点破'无非要贿赂'，刘备说'秋毫无犯哪有财物'。次日督邮提县吏去，勒令指称县尉害民；刘备几番求见被门役阻住。要点：督邮的每一层嚣张都精准踩在'军功反被辱'的痛点上——关张的怒与刘备的忍形成张力，百姓的哭诉是引信",
  "tension_level": 0.7,
  "must_include": [
    "朝廷降诏沙汰军功官吏——大背景",
    "督邮城外坐马、微以鞭指回答——傲慢",
    "馆驿高坐、问'何出身'——审犯人式盘问",
    "大喝'诈称皇亲虚报功绩'——颠倒黑白",
    "县吏点破：'无非要贿赂'",
    "督邮逼县吏诬告刘备害民",
    "刘备求见被门役阻住"
  ],
  "must_avoid": [
    "让刘备显得过于窝囊——他的忍是有政治智慧的隐忍",
    "省略关张的反应——他们的怒是对读者情绪的引导",
    "让督邮变成脸谱化反派——他代表的是整个体制的腐败，不只是个人恶"
  ],
  "status": "draft"
}
