{
  "scene_id": "cp001_p03_s1",
  "chapter_id": "cp001",
  "passage_id": "p03",
  "scene_type": "reveal",
  "purpose_cn": "关羽登场——先声夺人再以人服人。大汉推车进店要投军，外貌描写令读者一震，自报身世交代来路，三人一拍即合，同往张飞庄上",
  "setting_cn": "涿县村店",
  "characters": ["liu_bei", "guan_yu", "zhang_fei"],
  "scene_goal_cn": "接住p02结尾的'门口影子'——一个推车大汉进店，快斟酒要赶去投军。刘备看他：九尺身高、二尺长须、面如重枣、丹凤眼卧蚕眉。邀请同坐，关羽自报河东解良人，杀势豪逃亡五六年。刘备以志向相告，关羽大喜。张飞带二人回庄。三个陌生人的相互识别要快而准——不需要试探，一看就知道是同类人",
  "tension_level": 0.5,
  "must_include": [
    "推车到店门、快斟酒投军的急切",
    "关羽外貌：身长九尺、髯长二尺、面如重枣、唇若涂脂、丹凤眼、卧蚕眉",
    "关羽自报：姓关名羽、河东解良人、杀势豪逃亡五六年",
    "刘备主动邀他同坐",
    "刘备以己志告之、关羽大喜",
    "三人同到张飞庄上"
  ],
  "must_avoid": [
    "让关羽长篇自我介绍",
    "让张飞喧宾夺主——这里是关羽的亮相",
    "刘备重复自报已在p02交代过的身世细节",
    "把三人相认写成廉价的'一见如故'套话"
  ],
  "status": "draft"
}
