{
  "scene_id": "cp001_p03_s3",
  "chapter_id": "cp001",
  "passage_id": "p03",
  "scene_type": "momentum",
  "purpose_cn": "从结义兄弟变成武装力量——天降贵人送马送钱，三人打造标志性兵器，聚五百人投军，刘焉认侄。节奏要快，用一系列动作推进，不拖泥带水",
  "setting_cn": "张飞庄院 → 邹靖处 → 太守府",
  "characters": ["liu_bei", "guan_yu", "zhang_fei", "zhang_shiping", "su_shuang", "liu_yan"],
  "scene_goal_cn": "结义次日收拾军器，苦于无马。正犯愁时，两个中山大商（张世平、苏双）赶着一群马投庄而来——因寇发折返。刘备迎入设酒，诉说讨贼安民之意，商人慨然相赠：良马五十匹、金银五百两、镔铁一千斤。天意在帮他们。良匠打造兵器：刘备双股剑、关羽青龙偃月刀（冷艳锯、八十二斤）、张飞丈八点钢矛。各置全身铠甲。共聚乡勇五百余人，由邹靖引见太守刘焉。刘焉听闻刘备宗派，大喜认侄。这一幕要用简洁的节奏把'从零到军'的过程交代完，留给读者的印象是：一切都在加速",
  "tension_level": 0.4,
  "must_include": [
    "无马的困境",
    "两个商人张世平、苏双赶马投庄（因寇发折返）",
    "刘备迎客设酒、诉说志向",
    "商人赠马五十匹、金银五百两、镔铁一千斤",
    "三件标志性兵器：双股剑、青龙偃月刀（冷艳锯、八十二斤）、丈八点钢矛",
    "各置全身铠甲",
    "聚乡勇五百余人",
    "邹靖引见刘焉",
    "刘焉认刘备为侄"
  ],
  "must_avoid": [
    "展开商人客套对话的过程",
    "罗列兵器锻造的技术细节",
    "让赠礼显得刻意或巧合到不真实",
    "在刘焉认侄上停留太久"
  ],
  "status": "draft"
}
