{
  "scene_id": "cp002_p02_s2",
  "chapter_id": "cp002",
  "passage_id": "p02",
  "scene_type": "reveal",
  "purpose_cn": "孙坚的惊艳亮相与人物塑造——用闪回叙事嵌入战斗间隙，让读者记住的是一个'十七岁就敢独斗海贼'的猛虎之将",
  "setting_cn": "朱儁营寨前 → 闪回：钱塘江岸、会稽战场",
  "characters": ["sun_jian", "zhu_jun"],
  "scene_goal_cn": "朱儁正欲攻打宛城，忽见正东一彪人马到来——为首者广额阔面、虎体熊腰，正是孙坚。用两段闪回快速建立人物：十七岁钱塘岸边见海贼分赃，独自提刀上岸，虚张声势杀一贼，从此扬名；后会稽许昌自称'阳明皇帝'聚众数万，孙坚募勇士千余人破之斩其父子。今闻黄巾寇起，聚淮泗精兵一千五百余人前来接应。要点：背景交代不是简历罗列，而是两个小故事——'少年杀贼'显勇，'破许昌'显能，让人物立起来",
  "tension_level": 0.4,
  "must_include": [
    "孙坚外貌：广额阔面、虎体熊腰",
    "吴郡富春人，孙武子之后",
    "十七岁钱塘独斗海贼的少年往事",
    "破会稽许昌之乱的战功",
    "率淮泗精兵一千五百余人来投",
    "朱儁大喜接纳"
  ],
  "must_avoid": [
    "把闪回写成平铺直叙的履历表",
    "罗列所有官职（盐渎丞、盱眙丞、下邳丞可合并一笔带过）",
    "在此处展开孙坚与刘备的互动",
    "过度渲染孙武之后的血统意义"
  ],
  "status": "draft"
}
