{
  "scene_id": "cp001_p04_s1",
  "chapter_id": "cp001",
  "passage_id": "p04",
  "scene_type": "combat",
  "purpose_cn": "三兄弟首战——快刀斩乱麻。五百对五万，数字吓人，但战场上只看刀枪。张飞一矛捅死邓茂，关羽一刀劈了程远志，干净利落。这是读者第一次看到三兄弟的武力——不是花架子，是杀人的本事",
  "setting_cn": "大兴山下，涿郡境内",
  "characters": ["liu_bei", "guan_yu", "zhang_fei", "zou_jing", "cheng_yuanzhi", "deng_mao"],
  "scene_goal_cn": "消息传来：黄巾贼将程远志带五万人来犯涿郡。刘焉派邹靖带着三兄弟和五百人去迎敌。大兴山下两军照面——对面乌压压一片，但三兄弟没怕。程远志派副将邓茂出战，张飞冲出去，一矛刺中邓茂心窝。程远志见折了人亲自冲张飞，关羽纵马迎上去一刀劈成两段。群贼溃散，大胜回城。这场仗要写得快、狠、干净——三兄弟初战告捷，读者应该觉得痛快",
  "tension_level": 0.8,
  "must_include": [
    "程远志率兵五万来犯涿郡",
    "邹靖引刘备等三人统兵五百迎敌",
    "大兴山下两军对阵",
    "贼众外貌：披发、黄巾抹额",
    "张飞刺邓茂心窝——丈八矛第一次杀人",
    "关羽斩程远志——冷艳锯第一次挥出",
    "众贼溃散投降者不计其数",
    "大胜回城，刘焉迎接赏劳"
  ],
  "must_avoid": [
    "让刘备在阵前叫骂——他不做那种事",
    "写回合制的武打——一矛一刀就解决，战场不是擂台",
    "给邓茂和程远志加戏——他们就是垫脚石",
    "把五百对五万写成轻松碾压——数字上的压力要让读者感觉到"
  ],
  "status": "draft"
}
