{
  "scene_id": "cp001_p02_s3",
  "chapter_id": "cp001",
  "passage_id": "p02",
  "scene_type": "reveal",
  "purpose_cn": "张飞登场，一声厉喝打破沉寂，二人互报身份志向后一拍即合——资源与抱负互补，行动从此刻开始",
  "setting_cn": "涿县城门榜文前 → 村店",
  "characters": ["liu_bei", "zhang_fei"],
  "scene_goal_cn": "张飞外貌先声夺人（豹头环眼、声若巨雷），性格直来直去——'大丈夫不与国家出力，何故长叹？'。刘备坦诚相告后，张飞毫不犹豫提出出资招募乡勇。两人的互补关系要一步建立：刘备有志无财，张飞有财缺方向。最后以'同入村店饮酒'收束，为关羽登场留口",
  "tension_level": 0.7,
  "must_include": [
    "张飞厉声质问：大丈夫何故长叹",
    "张飞外貌：豹头环眼、燕颔虎须、声若巨雷",
    "张飞自报：涿郡人、有庄田、卖酒屠猪、好结交豪杰",
    "刘备自报：汉室宗亲、有志破贼、恨力不能",
    "张飞出资提议与刘备'甚喜'",
    "同入村店饮酒"
  ],
  "must_avoid": [
    "把张飞写成只会大吼的莽夫",
    "让刘备显得被动或软弱",
    "在这一幕提前暗示关羽"
  ],
  "status": "draft"
}
