{
  "scene_id": "cp001_p02_s1",
  "chapter_id": "cp001",
  "passage_id": "p02",
  "scene_type": "setup",
  "purpose_cn": "为刘备建立完整的人物底色：血统、外貌、性格、童年志向、落魄现状——一个被命运压住但未被磨灭的英雄",
  "setting_cn": "涿县楼桑村，全知视角回溯叙述",
  "characters": ["liu_bei"],
  "scene_goal_cn": "用紧凑笔法交代刘备的核心信息：皇族后裔→父亲早丧→家贫织席→楼桑大树的贵气预言→童年'我为天子'的豪言→十五岁游学师从卢植。读者应同时感受到'这个人不凡'和'这个人很苦'两层",
  "tension_level": 0.3,
  "must_include": [
    "中山靖王刘胜之后的血统",
    "身长七尺五寸、两耳垂肩、双手过膝的外貌",
    "楼桑大树下'我为天子当乘此车盖'的童年事件",
    "家贫、贩屦织席为业",
    "事母至孝"
  ],
  "must_avoid": [
    "逐条罗列祖先世系",
    "展开刘元起资助的细节",
    "写成人物简历式的流水账"
  ],
  "status": "draft"
}
